{
    "schema_version": "1.0.0",
    "strategy_id": "momentum_fade_exit",
    "version": 1,
    "name": "Momentum fade exit",
    "description": "Tests an exit when momentum weakens inside a regime labelled uptrend; labels may lag.",
    "action": "SELL",
    "market": "binance_spot_usdt",
    "regimes": [
        "uptrend"
    ],
    "timeframe": "1h",
    "feature_contract": "hourly-v1",
    "entry_conditions": [
        {
            "id": "rsi_weakening",
            "left": {
                "feature": "rsi14"
            },
            "operator": "lt",
            "right": {
                "value": "45"
            }
        }
    ],
    "confirmation_conditions": [
        {
            "id": "hour_negative",
            "left": {
                "feature": "return_1h_percent"
            },
            "operator": "lt",
            "right": {
                "value": "0"
            }
        }
    ],
    "invalidation_conditions": [
        {
            "id": "day_strong",
            "left": {
                "feature": "return_24h_percent"
            },
            "operator": "gt",
            "right": {
                "value": "8"
            }
        }
    ],
    "risk_constraints": {
        "max_risk_fraction": "0.01",
        "max_allocation_fraction": "0.1",
        "stop_loss_fraction": "0.02",
        "take_profit_fraction": "0.04",
        "min_reward_risk": "2",
        "min_quote_volume": "1000000",
        "max_absolute_return_1h_percent": "5",
        "max_data_age_seconds": 3660
    },
    "provenance": {
        "kind": "research_hypothesis",
        "author": "Crypto Decision Lab example library",
        "source": "Repository-authored illustrative hypothesis; no empirical source or performance claim.",
        "created_at": "2026-10-18T00:00:00Z",
        "rationale": "Tests an exit when momentum weakens inside a regime labelled uptrend; labels may lag.",
        "limitations": [
            "Untested; no estimated win rate or probability of profit.",
            "Requires point-in-time features, regime labels, liquidity and cost observations.",
            "Thresholds are examples, not validated recommendations."
        ]
    },
    "validation": {
        "status": "unvalidated",
        "eligibility": "research_only",
        "evidence_ids": []
    }
}
