{
    "schema_version": "1.0.0",
    "strategy_id": "ema_trend_continuation",
    "version": 1,
    "name": "EMA trend continuation",
    "description": "Tests whether aligned price and EMA structure continues; lag can create late entries.",
    "action": "BUY",
    "market": "binance_spot_usdt",
    "regimes": ["uptrend"],
    "timeframe": "1h",
    "feature_contract": "hourly-v1",
    "entry_conditions": [
        {
            "id": "price_above_fast",
            "left": {
                "feature": "close"
            },
            "operator": "gt",
            "right": {
                "feature": "ema20"
            }
        },
        {
            "id": "fast_above_slow",
            "left": {
                "feature": "ema20"
            },
            "operator": "gt",
            "right": {
                "feature": "ema50"
            }
        }
    ],
    "confirmation_conditions": [
        {
            "id": "positive_momentum",
            "left": {
                "feature": "rsi14"
            },
            "operator": "gte",
            "right": {
                "value": "50"
            }
        }
    ],
    "invalidation_conditions": [
        {
            "id": "lost_slow_average",
            "left": {
                "feature": "close"
            },
            "operator": "lt",
            "right": {
                "feature": "ema50"
            }
        }
    ],
    "risk_constraints": {
        "max_risk_fraction": "0.01",
        "max_allocation_fraction": "0.1",
        "stop_loss_fraction": "0.02",
        "take_profit_fraction": "0.04",
        "min_reward_risk": "2",
        "min_quote_volume": "1000000",
        "max_absolute_return_1h_percent": "5",
        "max_data_age_seconds": 3660
    },
    "provenance": {
        "kind": "research_hypothesis",
        "author": "Crypto Decision example library",
        "source": "Repository-authored illustrative hypothesis; no empirical source or performance claim.",
        "created_at": "2026-10-18T00:00:00Z",
        "rationale": "Tests whether aligned price and EMA structure continues; lag can create late entries.",
        "limitations": [
            "Untested; no estimated win rate or probability of profit.",
            "Requires point-in-time features, regime labels, liquidity and cost observations.",
            "Thresholds are examples, not validated recommendations."
        ]
    },
    "validation": {
        "status": "unvalidated",
        "eligibility": "research_only",
        "evidence_ids": []
    }
}
